<?xml version="1.0" encoding="UTF-8" ?>

<!DOCTYPE mapper
    PUBLIC "-//ibatis.apache.org//DTD Mapper 3.0//EN"
    "http://ibatis.apache.org/dtd/ibatis-mapper-3.dtd">

<mapper namespace="com.domain.BlogMapper">

  <resultMap id="" type="" extends="">
    <constructor>
      <id column="" javaType="" jdbcType="" typeHandler="" />
      <result column="" javaType="" jdbcType="" typeHandler=""/>
    </constructor>
    <result property="" column="" javaType="" jdbcType="" typeHandler=""/>
    <collection property="" column="" javaType="" select="" resultMap=""/>
  </resultMap>

  <select id="selectAllPeople" useCache="true" flushCache="false" parameterType="" resultType="" resultMap="">
    select * from PERSON order by
    ${opts.order,javaType="",jdbcType="",typeHandler="",mode="",scale="",resultMap=""}
  </select>
  
</mapper>